URL,Title,Title Length,Title OK,Meta Description,Meta Length,Meta OK,H1,H1 Count,H2 Count
https://www.atlascopco.com/en-us/compressors/guides-and-ebooks/ebook-compressor-comparison,E-book rotary screw compressor comparison - Atlas Copco USA,59,True,"Which rotary screw compressor is right for you? To help you find the optimal solution, this guide outlines the different technologies and what they have to offer.",162,False,E-book rotary screw compressor comparison,1,1
https://www.atlascopco.com/en-us/compressors/guides-and-ebooks/ebook-connectivity,E-book connectivity - Atlas Copco USA,37,True,"Compressor connectivity incorporates the latest technology to enable a truly smart production. In this e-book, you will learn how you can make new connectivity features work for you.",182,False,E-book connectivity,1,0
https://www.atlascopco.com/en-us/compressors/guides-and-ebooks/smart-checklist,How smart is your compressed air system?  - Atlas Copco USA,59,True,Use the checklist to see which innovative technology is already integrated with your compressed air system or what can still be improved.,137,True,How smart is your compressed air system?,1,2
https://www.atlascopco.com/en-us/compressors/guides-and-ebooks/application-ebooks/application-ebook-contact-form0,,0,False,,0,False,,0,0
https://www.atlascopco.com/en-us/compressors/guides-and-ebooks/application-ebooks/personalized-application-ebook,,0,False,,0,False,,0,0
https://www.atlascopco.com/en-us/compressors/guides-and-ebooks/ebook-green-production,7 easy ways to reduce your air compression costs  - Atlas Copco USA,67,False,High energy costs are a real problem for many businesses. In this e-book you will learn some easy ways to reduce the cost of compressed air.,140,True,7 easy ways to reduce your air compression costs,1,3
https://www.atlascopco.com/en-us/compressors/guides-and-ebooks/ebook-energy-cost-savings,E-book energy cost savings - Atlas Copco USA,44,True,In this e-book from Atlas Copco you will learn the many ways to reduce the cost of compressing air.,99,True,E-book Energy Cost Savings,1,1
https://www.atlascopco.com/en-us/compressors/guides-and-ebooks/application-ebooks/microbreweries,E-book microbreweries - Atlas Copco USA,39,True,"Atlas Copco can make your brewery operation a lot easier with a comprehensive offer in compressed air systems, nitrogen generators, process cooling solutions, pipework, and specialized filtration products.",205,False,E-book on microbreweries,1,2
https://www.atlascopco.com/en-us/compressors/guides-and-ebooks/application-ebooks/ev-battery-production,E-book EV battery production - Atlas Copco USA,46,True,"Atlas Copco offers everything that an EV battery production plant needs, including oil-free and oil-injected compressors, air dryers, filtration, nitrogen and oxygen generation, CO2 removal, low pressure blowers, vacuum equipment and energy recovery.",250,False,E-book on EV battery production,1,2
https://www.atlascopco.com/en-us/compressors/guides-and-ebooks/application-ebooks,Application e-books - Atlas Copco USA,37,True,"Whether it's the use of nitrogen in the brewing industry, the role of oxygen in biogas production, or the benefits of on-site nitrogen generation for EV battery manufacturing and hydrogen fuel stations, Atlas Copco offers a comprehensive range of compressed air and gas solutions for your application needs.",307,False,Application e-books,1,0
https://www.atlascopco.com/en-us/compressors/guides-and-ebooks/application-ebooks/biogas-production,E-book biogas production - Atlas Copco USA,42,True,"Atlas Copco’s oxygen generators are more cost-effective than bottled/liquid oxygen and offer the required purity with a high flow capacity, making them perfect for biogas production.",182,False,E-book on biogas production,1,2
https://www.atlascopco.com/en-us/compressors/guides-and-ebooks/application-ebooks/hydrogen-fuel-stations,E-book hydrogen fuel stations - Atlas Copco USA,47,True,"Atlas Copco can make your hydrogen fuel station operation a lot easier with a comprehensive range of oil-free compressors, adsorption dryers, membrane generators, filtration solutions, and central control systems.",213,False,E-book hydrogen fuel stations,1,1
https://www.atlascopco.com/en-us/compressors/guides-and-ebooks/application-ebooks/ebook-laser-cutting,E-book laser cutting - Atlas Copco USA,38,True,"Laser cutting is a highly precise and versatile technology used for cutting and shaping metal such as stainless steel, carbon steel or aluminum. Atlas Copco offers nitrogen and oxygen solutions as well as compressed air for your laser cutting operations.",254,False,E-book: Industrial Gases and Compressed Air for Laser Cutting,1,4
https://www.atlascopco.com/en-us/compressors/guides-and-ebooks/application-ebooks/food-and-beverage-ebook,Food and Beverage eBook - Atlas Copco USA,41,True,"Taste, quality, and safety are the constant in the food and beverage industry, but there's a fundamental yet overlooked ingredient: compressed air.",147,True,Food and beverage eBook,1,4
https://www.atlascopco.com/en-us/compressors/guides-and-ebooks/ebook-innovation,Ebook Innovation - Atlas Copco USA,34,True,"Discover the advantages of choosing Atlas Copco as your innovative compressed air partner in this e-book. With benefits such as energy savings, increased reliability, and seamless Industry 4.0 integration.",205,False,E-book Innovation,1,1
https://www.atlascopco.com/en-us/compressors/guides-and-ebooks/high-pressure-ebook,E-book medium- and high-pressure compressors and boosters  - Atlas Copco USA,76,False,"Explore Atlas Copco's medium- and high-pressure oil-lubricated compressors and boosters for optimal efficiency and performance in medium to high-pressure applications, including laser cutting, plastics molding, surge vessels, and more.",235,False,E-book medium- and high-pressure oil-lubricated compressors and boosters up to 65 kW,1,1
https://www.atlascopco.com/en-us/compressors/guides-and-ebooks/ga-flx-dual-speed-compressor-complete-guide,GA FLX dual-speed compressor: a complete guide - Atlas Copco USA,64,False,Discover the groundbreaking GA FLX dual-speed compressor by Atlas Copco. Save up to 20% in energy costs compared to traditional fixed-speed models. Read this guide to learn more.,178,False,GA FLX dual-speed compressors: a complete guide,1,1
https://www.atlascopco.com/en-us/compressors/guides-and-ebooks/digital-transformation-ebook,Digital Transformation eBook  - Atlas Copco USA,47,True,"By embracing the power of technology as the core of your business, you can take your compressor room to the next level through a journey of digital transformation. This eBook uncovers the five signs your compressor room embodies this transformative journey.",257,False,Digital Transformation eBook,1,1
https://www.atlascopco.com/en-us/compressors/guides-and-ebooks/ebook-energy-recovery,Energy recovery – the win-win proposition  - Atlas Copco USA,60,True,"Using energy recovery is always the smart choice when you own and operate a compressor. Lear more on compressor heat recovery, its benefits, and its impressively wide range of applications.",189,False,Energy Recovery eBook,1,7
https://www.atlascopco.com/en-us/compressors/guides-and-ebooks/10-year-compressed-air-system-check,Is It Time to Replace Your Air Compressor? - Atlas Copco USA,60,True,"Is your air compressor system over 10 years old? Discover our free interactive eBook to check efficiency, hidden costs, and replacement timing.",143,True,Is your compressed air system 10 years old?,1,1
https://www.atlascopco.com/en-us/compressors/guides-and-ebooks/aircube-ebook,AIRCUBE eBook  - Atlas Copco USA,32,True,"AIRCUBE is your modular solution for optimized compressed air. It's a complete solution that is flexible, scalable, energy-efficient, customizable, and more. Explore how AIRCUBE is the perfect compressed air system for your application.",236,False,AIRCUBE eBook,1,2
https://www.atlascopco.com/en-us/compressors/guides-and-ebooks/ebook-understanding-compressor-system,Understanding compressor systems: A practical guide to optimisation & efficiency - Atlas Copco USA,98,False,"A concise guide to improving compressed air efficiency through optimisation of inputs, components, controls, piping, and maintenance.",133,True,Ebook understanding compressor systems,1,1
https://www.atlascopco.com/en-us/compressors/variable-speed-compressors/smart-factory,Choosing the optimal air compressor for your smart factory  - Atlas Copco USA,77,False,"When choosing an air compressor to work with your smart factory, you’ll want the latest features found in this article.",119,True,Choosing the optimal air compressor for your smart factory,1,5
https://www.atlascopco.com/en-us/compressors/variable-speed-compressors,Variable speed compressors - Atlas Copco USA,44,True,"When exploring compressors, you’ll want one that covers all your needs. From reliability to smart technology, variable speed drive compressors have you covered.",160,True,Variable speed drive compressors,1,7
https://www.atlascopco.com/en-us/compressors/variable-speed-compressors/reduced-air-compressor-electricity-consumption,Achieve reduced air compressor electricity consumption  - Atlas Copco USA,73,False,"If you want to reduce electricity consumption, investing in a new variable speed drive (VSD) air compressor may be worthwhile.",126,True,Achieve reduced air compressor electricity consumption,1,4
https://www.atlascopco.com/en-us/compressors/variable-speed-compressors/low-emissions,Achieve low emissions with efficient air compressors  - Atlas Copco USA,71,False,The newest air compressors from Atlas Copco are designed to be clean and energy efficient.,90,True,Achieve low emissions with efficient air compressors,1,4
https://www.atlascopco.com/en-us/compressors/variable-speed-compressors/air-compressor-reliability,Maximum air compressor reliability for lower operating costs  - Atlas Copco USA,79,False,"Reliability is crucial with any air compressor set up, especially when downtime adds unexpected costs. Find out how to increase uptime with a VSD compressor.",157,True,Maximum air compressor reliability for lower operating costs,1,6
https://www.atlascopco.com/en-us/compressors/variable-speed-compressors/quiet-air-compressor-installation,A quiet air compressor installation  - Atlas Copco USA,54,True,"If you have your equipment on the production floor, rather than in a separate utility room, you’ll want a quiet air compressor. Learn about various options.",156,True,A quiet air compressor installation,1,4
https://www.atlascopco.com/en-us/compressors/variable-speed-compressors/selecting-the-right-size,Selecting the right size industrial air compressor   - Atlas Copco USA,70,False,"As you may know, industrial air compressors come in a variety of sizes to meet different industrial application needs. Find out why a VSD might be ideal.",153,True,Selecting the right size for your industrial air compressor,1,5
https://www.atlascopco.com/en-us/compressors/variable-speed-compressors/versatility-and-custom-performance,Choosing the best air compressor for versatility and a custom performance  - Atlas Copco USA,92,False,"As each company has different compressed air needs, it can be hard to decide on the best air compressor. A VSD offers versatility for a custom performance.",155,True,Choosing the best air compressor for versatility and a custom performance,1,3
https://www.atlascopco.com/en-us/compressors/variable-speed-compressors/vsd-fact-checks,VSD Fact Checks - Atlas Copco USA,33,True,VSD Fact Checks,15,False,VSD Fact Checks: Exploring the fact of Variable Speed Drive Compressor Technology,1,2
https://www.atlascopco.com/en-us/compressors/variable-speed-compressors/vsd-fact-checks/vsd-fact-checks-compressors-in-mining,Fact check: VSD compressors in mining are a smart idea   - Atlas Copco USA,74,False,Explore the benefits of Variable Speed Drive (VSD) compressors in mining operations. Learn how VSD technology is revolutionizing reliability and energy efficiency in mining.,173,False,Fact Check: it’s a smart idea to use VSD compressors in mining,1,5
https://www.atlascopco.com/en-us/compressors/variable-speed-compressors/vsd-fact-checks/best-compressor-in-dusty-environment,Fact check: The best air compressor for a dusty environment isn’t always fixed speed  - Atlas Copco USA,103,False,"There are efficient variable speed drive (VSD) machines available that can operate reliably in dusty environments, making them the best air compressor overall.",159,True,Fact check: The best air compressor for a dusty environment isn’t always fixed speed,1,5
https://www.atlascopco.com/en-us/compressors/variable-speed-compressors/vsd-fact-checks/vsd-same-working-principle,Fact Check: all VSD compressors have the same working principle - Atlas Copco USA,81,False,"While it's true that VSD compressor equipment is typically more efficient than fixed speed machines, there is more beyond the surface.",134,True,Fact Check: all VSD compressors have the same working principle,1,6
https://www.atlascopco.com/en-us/compressors/variable-speed-compressors/vsd-fact-checks/vsd-compressor-humidity-fact-check,Fact Check: VSD Compressor Technology are not suitable for High-Humidity Environments - Atlas Copco USA,103,False,"Look for advanced VSD compressor technology, which prevents condensation from impacting operations in humid conditions.",119,True,Fact check: VSD compressor technology are not suitable for high-humidity environments,1,3
https://www.atlascopco.com/en-us/compressors/variable-speed-compressors/vsd-fact-checks/fixed-speed-vs-stable-air-demand,Fact check: Fixed speed compressors are better for stable air demand - Atlas Copco USA,86,False,A stable airflow doesn’t automatically justify a fixed-speed compressor. Advanced VSDs reduce energy losses and deliver superior efficiency under all demand profiles.,166,False,Fact check: Fixed-speed compressors are better for stable air demand,1,2
https://www.atlascopco.com/en-us/compressors/variable-speed-compressors/vsd-fact-checks/vsds-are-the-best-air-compressor,Fact check: VSDs are the best in class compressor for withstanding heat  - Atlas Copco USA,90,False,"With smart algorithms, variable speed drive (VSD) equipment can run hotter for longer. This makes them the overall best air compressor type.",140,True,Fact check: VSD are the best in class compressor for withstanding heat,1,3
https://www.atlascopco.com/en-us/compressors/variable-speed-compressors/vsd-fact-checks/most-compressor-have-stable-airflow,Fact check: Most compressor users assume they have stable airflow  - Atlas Copco USA,84,False,Most air systems experience demand fluctuations. A proper audit can reveal the truth – and a well-designed VSD compressor usually delivers the best energy efficiency in real-world conditions.,191,False,Fact check: Most compressor users assume they have stable airflow,1,2
https://www.atlascopco.com/en-us/compressors/variable-speed-compressors/vsd-fact-checks/vsd-compressors-are-not-suitable-for-small-workshop,Fact check: VSD compressors are not suitable for a small workshop - Atlas Copco USA,83,False,"Compact VSD compressors like the Atlas Copco G 2–7 VSD range are ideal for small workshops, offering a small footprint, low noise, energy efficiency, and advanced control, even in low-demand settings.",200,False,Fact check: VSD compressors are not suitable for a small workshop,1,6
https://www.atlascopco.com/en-us/compressors/variable-speed-compressors/vsd-fact-checks/when-vsd-is-not-compatible-with-existing-vsd,Fact check: An Atlas Copco VSD is not suitable if a different brand VSD is already installed  - Atlas Copco USA,111,False,Atlas Copco VSD compressors can be integrated into systems with different brands. Smart controllers like Equalizer help manage them all for optimal performance and efficiency.,175,False,Fact check: An Atlas Copco VSD is not suitable if a different brand VSD is already installed,1,2
https://www.atlascopco.com/en-us/compressors/variable-speed-compressors/vsd-fact-checks/fact-check-vsd-is-not-for-full-speed,"Fact check: VSD compressors are not designed to run at full speed, 100% of the time  - Atlas Copco USA",102,False,"Atlas Copco VSD compressors are engineered as complete systems, capable of running at full speed without compromising efficiency or reliability.",144,True,"Fact check: VSD compressors are not designed to run at full speed, 100% of the time",1,6
https://www.atlascopco.com/en-us/compressors/variable-speed-compressors/vsd-fact-checks/vsd-not-best-for-multiple-compressors,Fact check: VSD is not the best solution for installations with multiple compressors  - Atlas Copco USA,103,False,"Forget the old base-load logic. Full-VSD compressor rooms offer better energy efficiency, lower running costs, and tighter pressure control than traditional fixed-speed+VSD installations.",187,False,Fact check: VSD is not the best solution for installations with multiple compressors,1,7
https://www.atlascopco.com/en-us/compressors/variable-speed-compressors/vsd-fact-checks/vsd-less-efficient-at-full-load,Fact check: A VSD compressor is less efficient than a fixed speed model at maximum load     - Atlas Copco USA,109,False,High-quality VSD compressors like Atlas Copco’s are more efficient than fixed-speed models – even at maximum load – and offer far greater savings in real-world conditions.,171,False,Fact check: A VSD compressor is less efficient than a fixed speed model at maximum load,1,7
https://www.atlascopco.com/en-us/compressors/variable-speed-compressors/vsd-fact-checks/inverter-compressors-is-no-different-than-standard-drives,Fact check: Atlas Copco’s inverter is no different than standard drives  - Atlas Copco USA,90,False,"Atlas Copco’s Neos inverters are built in-house for optimal compressor performance, not retrofitted general-purpose drives. This results in improved durability, higher efficiency, and smarter integration.",204,False,Fact check: Atlas Copco’s inverter is no different than standard drives,1,8
https://www.atlascopco.com/en-us/compressors/variable-speed-compressors/vsd-fact-checks/vsd-compressors-electronics-not-overloaded,Fact Check: VSD compressors have too many electronic components  - Atlas Copco USA,82,False,"Atlas Copco VSD compressors include one extra component, the inverter, and it replaces more than it adds. No clutter, just smart, durable design for efficient air delivery.",172,False,Fact Check: VSD compressors have too many electronic components,1,7
https://www.atlascopco.com/en-us/compressors/variable-speed-compressors/vsd-fact-checks/vsd-compressors-complicated-to-operate,Fact check: VSD compressors are complicated to operate  - Atlas Copco USA,73,False,"Atlas Copco’s VSD compressors feature simple one-setpoint controls, a touchscreen interface, and remote access via SMARTLINK, making them easier to run than fixed-speed models.",176,False,Fact check: VSD compressors are complicated to operate,1,6
https://www.atlascopco.com/en-us/compressors/variable-speed-compressors/vsd-fact-checks/vsd-compressors-are-less-reliable-then-fixed-speed-compressors,Fact check: VSD compressors are less reliable than fixed-speed compressors  - Atlas Copco USA,93,False,"Atlas Copco VSD compressors reduce component wear, avoid hard start-stops, and include predictive monitoring, all of which add up to greater reliability than traditional fixed-speed machines.",191,False,Fact check: VSD compressors are less reliable than fixed-speed compressors,1,7
https://www.atlascopco.com/en-us/compressors/variable-speed-compressors/vsd-fact-checks/vsd-efficiency-any-scale,Fact check: VSD is not efficient for units below 15kW  - Atlas Copco USA,72,False,"VSD isn’t just for big machines. Atlas Copco’s G 2-7 VSD proves that small compressors can deliver major energy savings, lower noise, a small footprint, and stable pressure.",173,False,Fact check: VSD is not efficient for units below 15kW,1,7
https://www.atlascopco.com/en-us/compressors/variable-speed-compressors/vsd-fact-checks/vsd-compressors-have-higher-risk-of-failure,Fact check: VSD compressors have a higher risk of failure  - Atlas Copco USA,76,False,"Atlas Copco VSD compressors run cooler, cleaner, and smarter. They actually reduce failure risk with their lower wear, predictive diagnostics, and robust design for tough environments.",184,False,Fact check: VSD compressors have a higher risk of failure,1,7
https://www.atlascopco.com/en-us/compressors/variable-speed-compressors/more-than-air-compressor,More than air compressor - Atlas Copco USA,42,True,"When exploring compressors, you’ll want one that covers all your needs. From reliability to smart technology, variable speed drive compressors have you covered.",160,True,More than air compressor,2,10
https://www.atlascopco.com/en-us/compressors/gap-campaign/cut-the-carbon,Towards Better: Partnering with you on energy transformation,60,True,,0,False,Partnering with you on energy transformation,1,23
https://www.atlascopco.com/en-us/compressors/gap-campaign/cut-the-carbon/industrial-heat-pumps,Heat Pumps - Atlas Copco USA,28,False,About Industrial heat pumps​,28,False,,0,3
https://www.atlascopco.com/en-us/compressors/product-safety-product-quality,Guaranteed product safety and product quality - Atlas Copco USA,63,False,Learn how our process filtration products can boost safety and quality in your industry. Discover effective solutions for achieving optimal product standards.,158,True,Guaranteed safe quality end-products,1,6
https://www.atlascopco.com/en-us/compressors/gap-campaign/cut-the-carbon/revamp-and-upgrades,Aftermarket,11,False,"24/7, global presence. Find out how our aftermarket experts maximize your uptime.",81,True,Aftermarket,2,8
https://www.atlascopco.com/en-us/compressors/gap-campaign/cut-the-carbon/carbon-solutions,Carbon Capture Utilization and Storage,38,True,"The decarbonization of your application can amplify your productivity with solutions that capture, utilize and store CO2, a practice that has tripled in use over the last decade. Find out how CCUS can help you Cut The Carbon.",225,False,CCUS,1,10
https://www.atlascopco.com/en-us/compressors/gap-campaign/cut-the-carbon/gas-connectivity,Gas connectivity,16,False,"The GAS Connectivity solution enables customers to perform an improved, initial data analysis and interact with LIVE technical support when needed - and do so independently.",173,False,Gas Connectivity,1,9
https://www.atlascopco.com/en-us/compressors/pro-10-warranty,Pro-10 Warranty - Atlas Copco USA,33,True,Pro-10 Warranty - the 10-year element program for premium GA Compressors,72,True,Pro-10 Warranty,1,4
https://www.atlascopco.com/en-us/compressors/air-compressor-data,Use your compressor data to its  full potential - Atlas Copco USA,65,False,Use your compressor data to its  full potential,47,False,Everything is connected,4,1
https://www.atlascopco.com/en-us/compressors/gap-campaign/cut-the-carbon/hydrogen-solutions,Hydrogen,8,False,Hydrogen is one of the most promising new and emerging means for driving decarbonization and the energy transition.,115,True,"Powering the Energy Transition: Hydrogen Production, Transportation and Usage",1,11
https://www.atlascopco.com/en-us/compressors/smart-factory,Smart factory - Atlas Copco USA,31,True,"The smart factory of the future will be connected, automated and much more efficient. But do you really have to wait? With our innovative products, that future begins now.",171,False,Steps to a smart factory,1,7
https://www.atlascopco.com/en-us/compressors/smart-factory/smartlink-prevents,SMARTLINK prevents problems - Atlas Copco USA,45,True,"Discover real-life situations that prove how data, coming from SMARTLINK connected compressors, helped our customers to prevent production outages.",147,True,SMARTLINK prevents problems,1,5
https://www.atlascopco.com/en-us/compressors/smart-factory/smart-factory-of-the-future,Welcome to the smart factory of the future  - Atlas Copco USA,61,False,The smart factory of the future will be much more efficient in every way. Atlas Copco experts weigh in on what it will look like.,129,True,Welcome to the smart factory of the future,1,6
https://www.atlascopco.com/en-us/compressors/smart-factory/smartlink-detects,SMARTLINK detects failures - Atlas Copco USA,44,True,SMARTLINK and our remote diagnostic center monitor your compressed air installation 24/7 to avoid that problems would deteriorate to failures.,142,True,SMARTLINK detects failures,1,6
https://www.atlascopco.com/en-us/compressors/smart-factory/smartlink-saves,SMARTLINK saves money - Atlas Copco USA,39,True,"Relying on the intelligence of SMARTLINK does not only make you save money, but also turns you more sustainable",111,True,SMARTLINK saves money,1,5
https://www.atlascopco.com/en-us/compressors/smart-factory/smart-small-compressor,A smart small compressor with the Elektronikon® Nano™ - Atlas Copco USA,71,False,"A smart small Atlas Copco compressor with the Elektronikon Nano isn’t just about convenience. It offers efficiency, cost savings, and future-proof performance.",159,True,A smart small compressor with Real-Time Monitoring | Elektronikon® Nano™,1,6
https://www.atlascopco.com/en-us/compressors/smart-factory/connectivity-scada-connection,Advanced connectivity with a SCADA connection  - Atlas Copco USA,64,False,"Explore how Atlas Copco’s advanced connectivity solutions drive your factory's digital transformation. Learn how to leverage remote monitoring, wireless sensor networks, and industrial network technologies for Industry 4.0",222,False,Advanced connectivity with a SCADA connection,1,10
https://www.atlascopco.com/en-us/compressors/smart-factory/ai-compressor-management,How AI air compressor management boosts IIoT - Atlas Copco USA,62,False,"With the help of Artificial Intelligence (AI), air compressor management enables the realization of the Industrial Internet of Things.",134,True,How AI air compressor management boosts IIoT,1,9
