URL,Title,Title Length,Title OK,Meta Description,Meta Length,Meta OK,H1,H1 Count,H2 Count
https://www.atlascopco.com/,Atlas Copco | Level up your experience,38,True,Atlas Copco | Level up your experience,38,False,,0,0
https://www.atlascopco.com/en-us/compressors/service/parts/maintenance-kits,Air compressor service kit,26,False,"Never forget to order a spare part. With our air compressor service kits, we deliver the compressor parts you need for your maintenance intervention.",149,True,Air compressor service kit,1,7
https://www.atlascopco.com/en-us/compressors/service/parts/air-compressor-filters,Air compressor filters and separators,37,True,Keep away dust and dirt contamination with genuine air compressor filters and separators.  Explore our range of air compressor filters,134,True,Air compressor filters and separators,1,16
https://www.atlascopco.com/en-us/compressors/service/parts/airnet-piping,AIRnet - Compressed air piping system,37,True,AIRnet provides a complete compressed air piping system from start to finish with the highest performance and efficiency for your distribution network.,151,True,AIRnet - Compressed air piping system,1,9
https://www.atlascopco.com/en-us/compressors/service/parts/line-filters,Air compressor line filters,27,False,"If your applications rely on the cleanest compressed air, our air compressor line filters will deliver. Minimal pressure drops, long lifetime, ISO-certified. See how",165,False,Air compressor line filters,1,8
https://www.atlascopco.com/en-us/compressors/service/parts/compressor-oil/1630114600-rotoinject,1630114600 Roto Inject Fluid NDURANCE - Atlas Copco USA,55,True,Atlas Copco Roto Inject Fluid NDURANCE is a mineral based oil specially formulated to protect your GA-GX rotary screw compressor,128,True,1630114600 : Roto Inject Fluid NDURANCE,1,3
https://www.atlascopco.com/en-us/compressors/service/parts/upgrade-programs,Air compressor upgrades,23,False,"Upgrade your compressor with the latest technology and components to improve your performance, energy consumption and reliability. See the difference.",150,True,Air compressor upgrades,1,13
https://www.atlascopco.com/en-us/compressors/service/parts/fixed-price-service,Fixed Price services - Best compressor parts & maintenance,58,True,Control your compressor maintenance budget with Fixed Price services. Rely on the expertise of our factory-trained technicians and quality of genuine parts,155,True,Fixed Price services - Best compressor parts & maintenance,1,9
https://www.atlascopco.com/en-us/compressors/service/parts,Air Compressor Parts & Accessories,34,True,Use Atlas Copco air compressor parts & accessories to increase your system lifetime. Enjoy the performance and quality you signed up for after each service intervention.,169,False,Air compressor parts,1,7
https://www.atlascopco.com/en-us/compressors/service/parts/compressor-oil,"Air compressor oil, lubricants and fluids",41,True,"Every type of air compressor & vacuum pump needs a specific oil to achieve maximum uptime, performance and lifetime. Our compressed air oils and fluids deliver.",160,True,"Air compressor oil, lubricants and fluids",1,13
https://www.atlascopco.com/en-us/compressors/service/parts/compressor-oil/1630204105-rotoultra,1630204105 : Roto Synthetic Fluid ULTRA - Atlas Copco USA,57,True,Roto Synthetic Ultra is a combination of a premium synthetic base fluid with an enhanced additive package for GA - GX - GN - GR compressors,139,True,1630204105 : Roto Synthetic Fluid ULTRA,1,3
https://www.atlascopco.com/en-us/compressors/service/parts/straightflo-valves,StraightFlo valves,18,False,"StraightFlo valves, unmatched performance",41,False,,0,12
https://www.atlascopco.com/en-us/compressors/service/parts/compressor-oil/2901170000-rotoxtend,2901170000 : Roto Synthetic Fluid Xtend Duty - Atlas Copco USA,62,False,"When your air compressors need to perform at top capacity, only the Atlas Copco lubricant is good enough. That’s why it pays to use RS Xtend Duty  2901 1700 00",159,True,2901170000 : Roto Synthetic Fluid Xtend Duty,1,3
https://www.atlascopco.com/en-us/compressors/service/parts/compressor-repair-any-brand,Air compressor repair and service for any brand,47,True,"Atlas Copco is the single service supplier for all your compressor repairs, spare parts and maintenance regardless your compressor brand or age.",144,True,Air compressor repair and service for any brand,1,9
https://www.atlascopco.com/en-us/compressors/service/parts/compressor-oil/2908850101-rotoz,2908850101 : Roto Z Fluid - Atlas Copco USA,43,True,"When your air compressors need to perform at top capacity, only the Atlas Copco oil is good enough. That’s why it pays to use Roto Z Fluid  2908850101",150,True,2908850101 : Roto Z Fluid,1,3
https://www.atlascopco.com/en-us/compressors/service/plans/preventive-maintenance,Preventive Maintenance Plan for optimal compressor uptime,57,True,Increase energy efficiency and optimize your air compressor uptime with a preventive maintenance plan. Rely on our trained technicians and genuine parts.,153,True,Preventive Maintenance Plan for optimal compressor uptime,1,13
https://www.atlascopco.com/en-us/compressors/service/parts/compressor-oil/1630083300-rotofoodgrade,1630083300 : Roto Foodgrade Fluid - Atlas Copco USA,51,True,"Certified Food grade oil for compressors operating in the food and beverage, pharmaceutical and packing industry",112,True,1630083300 : Roto Foodgrade Fluid,1,5
https://www.atlascopco.com/en-us/compressors/service/plans/air-plan,AIRPlan - All-inclusive contract for compressed air delivery,60,True,With AIRPlan you leave the compressed air equipment and it's maintenance in the hands of Atlas Copco and pay according to what you have consumed.,145,True,AIRPlan - All-inclusive contract for compressed air delivery,1,12
https://www.atlascopco.com/en-us/compressors/service/plans,Maximize your resources with a Service Plan,43,True,Reduce your total cost of ownership and benefit from optimal performance. Partner with Atlas Copco for maintenance and service plans and see the results,152,True,Air compressor service plan,1,7
https://www.atlascopco.com/en-us/compressors/service/plans/parts-plan,Parts Plan - Air compressor parts at your doorstep,50,True,"Genuine air compressor replacement parts, designed and produced to the specifications of your compressor. Delivered right where and when you need them.",151,True,Parts Plan - Air compressor parts at your doorstep,1,13
https://www.atlascopco.com/en-us/compressors/service/plans/inspection,Inspection Plan - A thorough check-up of your compressor room,61,False,"The Inspection Plan offers and advanced analysis of your compressed air system, performed by highly competent Atlas Copco technicians.",134,True,Inspection Plan - A thorough check-up of your compressor room,1,12
https://www.atlascopco.com/en-us/compressors/service/plans/totalcare,Total Care - Full service compressor maintenance,48,True,"Total Care keeps your compressed air equipment running in optimal condition, taking all maintenance off your hands. Go for the best compressor service value.",157,True,Total Care - Full service compressor maintenance,1,12
https://www.atlascopco.com/en-us/compressors/service/plans/total-responsibility,Total Responsibility Plan - Complete compressor care,52,True,"We take care of all your compressor maintenance, upgrades, repairs and even breakdowns for an all-inclusive price. Discover our Total Responsibility Plan",153,True,Total Responsibility Plan - Complete compressor care,1,11
https://www.atlascopco.com/en-us/compressors/service/plans/extended-warranty,Extended Warranty+  Service with a five year warranty,53,True,The Extended Warranty+ Plan extends the standard warranty of new machines to five years and includes complete preventive maintenance by our technicians.,152,True,Extended Warranty+Service with a five year warranty,1,14
https://www.atlascopco.com/en-us/compressors/service/efficiency/compressor-control-system,Optimize your installation with air compressor control systems,62,False,"Save energy, increase uptime and reduce CO2 emissions by using  air compressor central controllers.",99,True,Optimize your installation with air compressor control systems,1,9
https://www.atlascopco.com/en-us/compressors/service/efficiency,Optimize your compressed air system,35,True,"By analyzing, optimizing and monitoring your compressed air installation, you can make substantial energy savings. See how we can help you improve your compressor efficiency",173,False,Maximize the efficiency of your compressed air installation,2,6
https://www.atlascopco.com/en-us/compressors/service/efficiency/air-compressor-audit,AIRScan - Air compressor audit with tangible recommendations,60,True,Get a reliable air compressor audit and well-founded recommendations to improve your energy efficiency with AIRscan.  See how you can save up to 30%,148,True,AIRScan - Air compressor audit with tangible recommendations,1,8
https://www.atlascopco.com/en-us/compressors/service/efficiency/compressor-monitoring,SMARTLINK - Air compressor monitoring system,44,True,"Knowing the real-time status of your compressed air equipment & being able to react on it, is the best way to achieve optimal efficiency & maximum availability",159,True,SMARTLINK - Compressed air monitoring system,1,12
https://www.atlascopco.com/en-us/compressors/service/aftermarket-turbomachinery,Aftermarket,11,False,"24/7, global presence. Find out how our aftermarket experts maximize your uptime.",81,True,Aftermarket,2,8
https://www.atlascopco.com/en-us/compressors/service/efficiency/energy-recovery,Energy Recovery for GA oil-injected compressors,47,True,Energy recovery makes you reuse thermal energy for other industrial processes that require heat or steam. See how ER units optimize your system,143,True,Energy Recovery for GA oil-injected compressors,1,9
https://www.atlascopco.com/en-us/compressors/service/efficiency/compressed-air-measurement,Smart Sensors - compressed air measurement,42,True,"Smart Sensors - Advanced monitoring sensors, expertly designed for precision measurement in your application",108,True,Smart Sensors - Compressed air measurement solutions,1,14
https://www.atlascopco.com/en-us/compressors/service/efficiency/air-quality,Air quality monitoring,22,False,Stop worrying about the quality of your compressed air. Let the Air Quality Monitor do real-time  monitoring in compliance with ISO 8573-1.,139,True,Air quality monitoring,1,8
https://www.atlascopco.com/en-us/compressors/service/aftermarket-turbomachinery/preventative-maintenance,Preventative Maintenance,24,False,Preventive Maintenance for gas and process turbomachinery. High precision and top flexibility. See how it works,111,True,Preventive maintenance for turbo machinery,1,14
https://www.atlascopco.com/en-us/compressors/service/aftermarket-turbomachinery/genuine-spare-parts,Spare Parts,11,False,Aftermarket Services with genuine spare parts for the maintenance of our turbocompressors and expanders. Dedicated to gas and process industry. See how,151,True,Atlas Copco genuine spare parts for turbomachinery,1,11
https://www.atlascopco.com/en-us/compressors/service/aftermarket-turbomachinery/am-advanced-services,Advanced aftermarket Services for Gas and Process,49,True,"Taking the next step, our aftermarket Advanced Services provide you with high-value information, reducing your total cost of ownership.",135,True,,0,11
https://www.atlascopco.com/en-us/compressors/service/aftermarket-turbomachinery/turbo-preventative-maintenance,Service plans for turbomachinery,32,True,"Service plans for gas and process turbomachinery. Transparent, fixed-rate pricing. Maximum uptime, minimum maintenance downtime. This is how it works",149,True,,0,10
https://www.atlascopco.com/en-us/compressors/service/aftermarket-turbomachinery/am-redesign-upgrade,Redesign/Upgrades,17,False,Customized redesign and upgrade services expand the capacity of your existing gas and process turbomachinery to meet new requirements,133,True,Redesign and upgrade services for turbomachinery,1,9
https://www.atlascopco.com/en-us/compressors/service/aftermarket-turbomachinery/turbo-oil-plus,Advanced Services,17,False,Turbo Oil Plus is the official manufacturer-guaranteed lubricant for gas and process Turbomachinery. Engineered for top performance,131,True,Turbomachinery Turbo Oil Plus lubrication services,1,11
https://www.atlascopco.com/en-us/compressors/products/air-compressor/oil-free-air-compressors,Oil-free air compressors for clean air - Atlas Copco USA,56,True,Oil-free air compressors specifically developed for your applications where air quality is essential for your end-product and production processes,146,True,Oil-free air compressors for clean air,1,7
https://www.atlascopco.com/en-us/compressors/service/air-compressor-training,Air compressor product training and courses - Atlas Copco USA,61,False,Our academy's offer effective and world-class air compressor and dryer training programs to operation and maintenance teams.,124,True,Air compressor product training and courses,1,5
https://www.atlascopco.com/en-us/compressors/service/aftermarket-turbomachinery/am-breakdown-repair-service,Breakdown & Repair Service for Gas and Process,46,True,"Get up and running again as fast as possible with our Breakdown & Repair Service. Experienced service support 24/7, global and cost-efficient.",142,True,,0,6
https://www.atlascopco.com/en-us/compressors/service/aftermarket-turbomachinery/oda-analysis,Turbomachinery Operating Data Analysis (ODA),44,True,Fixed-cost Operating Data Analysis for preventative maintenance of your gas and process turbomachinery. Dedicated Aftermarket Services for top reliability.,155,True,,0,7
https://www.atlascopco.com/en-us/compressors/service/aftermarket-turbomachinery/am-erection-and-commissioning,Gas and Process Erection & Commissioning Service,48,True,Our Erection & Commissioning Service ensures your equipment is set up and launched the right way. Dedicated to Gas and Process.,127,True,,0,5
https://www.atlascopco.com/en-us/compressors/products/air-compressor,Air compressors models and industrial solutions - Atlas Copco USA,65,False,Discover the right air compressor for your industrial applications. Our range of reliable machines comes with a low life cycle cost.,132,True,Air compressors models and industrial solutions,1,15
https://www.atlascopco.com/en-us/compressors/products/air-compressor/oil-free-air-compressors/lfx-compact-piston,LFx compact oil-free piston compressors,39,True,The LFx compact oil-free piston compressors are 100% oil-free industrial compressors. Easy to maintain components. Low noise levels. Discover the benefits,154,True,LFx compact oil-free piston compressors,1,16
https://www.atlascopco.com/en-us/compressors/products/air-compressor/oil-free-air-compressors/lz-premium,LZ premium oil-free compressor,30,True,"One of the most complete oil-free piston compressors on the market today, the LZ meets all your compressed air needs. Unquestionably clean air. Zero compromises",160,True,LZ premium oil-free compressor,1,14
https://www.atlascopco.com/en-us/compressors/products/air-compressor/oil-free-air-compressors/lf-industrial-piston,LF industrial oil-free aluminum piston compressors,50,True,The LF compressors are certified 100% oil-free compressors and are suitable for stand-alone use or easy integration in your OEM product. Discover its benefits,158,True,LF industrial oil-free aluminum piston compressors,1,17
https://www.atlascopco.com/en-us/compressors/products/air-compressor/oil-free-air-compressors/zp-pet-bottle-compressor,PET bottle compressor ZP: air-cooled and plug & play,52,True,The plug and play reliable solution to meet your high pressure PET compressed air bottle needs. Our PET bottle compressor ZP offers a unique hassle free solution.,162,False,PET bottle compressor ZP: air-cooled and plug & play,1,16
https://www.atlascopco.com/en-us/compressors/products/air-compressor/oil-free-air-compressors/sf-and-sf-plus,SF+ & SFe oil-free scroll compressors,37,True,"The Atlas Copco SF ,SF+ and SFe oil-free scroll compressors provide pure, oil-free air for critical applications. Compact, quiet, easy to use and cost-efficient compressors.",173,False,SF+ & SFe oil-free scroll compressors,1,17
https://www.atlascopco.com/en-us/compressors/products/air-compressor/oil-free-air-compressors/aq-water-injected,AQ Compressors,14,False,"Pure, oil-free air with AQ water-injected screw compressors. Available in compact water-cooled and air-cooled versions, meet your precise needs for pure, oil-free air. See how.",176,False,AQ water-injected oil-free screw compressors,1,17
https://www.atlascopco.com/en-us/compressors/products/air-compressor/oil-free-air-compressors/centrifugal-compressor-zh-zhplus,Oil-free air centrifugal compressor ZH and ZH+,46,True,ZH and ZH+ oil-free air centrifugal compressors from 2 to 13 bar. High flow with low energy consumption for your critical processes. See how,140,True,Oil-free air centrifugal compressor ZH and ZH+,1,14
https://www.atlascopco.com/en-us/compressors/products/air-compressor/oil-free-air-compressors/lfxd-dental,LFxD - Dental Air Compressor,28,False,"LFx is the perfect dental air compressor for small practices. It is 100% oil-free dental air, it has a small footprint, it’s easy to install, of highest standard and available in several sizes.",193,False,LFxD - Dental Air Compressor,1,17
https://www.atlascopco.com/en-us/compressors/products/air-compressor/oil-free-air-compressors/high-pressure-reciprocating-air-compressor-p,High pressure reciprocating air compressor P,44,True,"Our high pressure reciprocating air compressors P are designed for reliable, safe and continuous operation in the most demanding environments.",142,True,High pressure reciprocating air compressor P,1,10
https://www.atlascopco.com/en-us/compressors/products/air-compressor/rotary-screw-compressor,Rotary screw air compressors - Atlas Copco USA,46,True,"Explore our range of rotary screw air compressors for sale: reliability, 100% duty cycle, low noise, and energy. Atlas Copco, experts in compressed air.",152,True,Achieve Peak Performance with Atlas Copco Rotary Screw Air Compressors,1,6
https://www.atlascopco.com/en-us/compressors/products/air-compressor/oil-free-air-compressors/single-stage-centrifugal-air-compressor-zhl,Single stage centrifugal compressor ZHL,39,True,Discover our ZHL sing-stage air compressor. An energy-efficient centrifugal compressor for applications up to 2 bar(g)/29 psig.,127,True,Single stage centrifugal compressor ZHL,1,12
https://www.atlascopco.com/en-us/compressors/products/air-compressor/oil-free-air-compressors/booster-air-compressor-zd,Oil-free booster air compressor ZD (VSD),40,True,The ZD (VSD) oil-free booster compressor delivers high quality 100% oil-free dry air or nitrogen at medium and high pressure ratios.,132,True,Oil-free booster air compressor ZD (VSD),1,14
https://www.atlascopco.com/en-us/compressors/products/air-compressor/oil-free-air-compressors/reciprocating-piston-compressors-hx-hn-15,Reciprocating piston compressors HX&HN-15,41,True,"Designed for continuous reliable and safe operation at low cost,  oil-free reciprocating piston compressors HX/HN-15 range is configured with 2 compression stages in a compact design.",183,False,Reciprocating piston compressors HX&HN-15,1,11
https://www.atlascopco.com/en-us/compressors/products/air-compressor/oil-free-air-compressors/low-pressure-screw-compressor-ze-za-vsd,Low pressure oil-free screw compressors ZE & ZA (VSD),53,True,ZE/ZA low-pressure oil-free screw technology gives high performance even in heavy duty conditions. For low pressure air systems.,128,True,Low pressure oil-free screw compressors ZE & ZA (VSD),1,13
https://www.atlascopco.com/en-us/compressors/products/air-compressor/oil-free-air-compressors/rotary-screw-air-compressors-zr-zt,Oil-free screw air compressors ZR & ZT (VSD),44,True,"100% oil-free rotary screw air compressors. State-of-the art range for outstanding performance. Efficient, safe, reliable – find out here",137,True,Oil-free screw air compressors ZR & ZT (VSD),1,22
https://www.atlascopco.com/en-us/compressors/products/air-compressor/oil-free-air-compressors/two-stage-centrifugal-compressor-zb2-vsd-plus,Oil-free two-stage centrifugal compressors ZB² VSD+,51,True,Oil-free two-stage centrifugal compressors ZB² VSD+,51,False,Oil-free two-stage centrifugal compressors ZB² VSD⁺,1,11
https://www.atlascopco.com/en-us/compressors/products/air-compressor/oil-free-air-compressors/rotary-tooth,ZR & ZT Oil-free rotary tooth air compressors,45,True,"Discover our state-of-the-art range of 100% oil-free rotary tooth compressors. Experience outstanding performance, efficiency, safety, and reliability.",151,True,Oil-free rotary tooth air compressors ZR & ZT,1,16
https://www.atlascopco.com/en-us/compressors/products/air-compressor/rotary-screw-compressor/g2-7,G 2-7 – The superior workshop compressor,40,True,"Atlas Copco’s G 2-7 rotary screw compressors give professional users and small businesses low noise, reliability, efficiency, and ease of use.",142,True,G 2-7 – The superior workshop compressor,1,16
https://www.atlascopco.com/en-us/compressors/products/air-compressor/rotary-screw-compressor/ga-vsds-series,GA 5-37 VSDˢ air compressor | Next-gen tech | Atlas Copco,57,True,"The sustainable GA 5-37 VSDˢ air compressor saves money, is highly connective & more. Discover it now.",102,True,GA 5-37 VSDˢ air compressor,1,21
https://www.atlascopco.com/en-us/compressors/products/air-compressor/rotary-screw-compressor/aircube-containerized-compressor-room,AIRCUBE - Containerized compressor room,39,True,"Atlas Copco’s AIRCUBE containerized compressor rooms quickly and flexibly supply a complete, high-quality compressed air system when and where you need it.",155,True,AIRCUBE - Containerized compressor room,1,15
https://www.atlascopco.com/en-us/compressors/products/air-compressor/rotary-screw-compressor/ga-screw-compressor,GA 37-90 oil-injected screw compressor,38,True,The GA 37-90 delivers the trusted Atlas Copco oil-injected screw performance and reliability at the lowest investment cost.,123,True,GA 37-90 oil-injected screw compressor,1,20
https://www.atlascopco.com/en-us/compressors/products/air-compressor/rotary-screw-compressor/ga-plus-screw-compressor,GA 30⁺-75⁺ oil-injected screw compressor,40,True,The smart fixed-speed industrial screw compressor that delivers premium reliability and extremely low operational costs.,120,True,,0,19
https://www.atlascopco.com/en-us/compressors/products/air-compressor/rotary-screw-compressor/ga-37-45-plus,GA 37+ - 45+ oil-injected rotary screw compressor,49,True,"The demands on air compressors are growing. Businesses investing in a compressed air system want it to be more energy-efficient, more reliable, smarter, quieter and smaller, at a low total cost of ownership. With its new GA 30+-45+ (37-45 kw/40-75 hp), Atlas Copco delivers all of the above and more.",300,False,GA 37+ - 45+ oil-injected rotary screw compressor,1,17
https://www.atlascopco.com/en-us/compressors/products/air-compressor/rotary-screw-compressor/oil-lubricated-screw-compressor-ga-180-315-vsd-plus,Oil lubricated screw compressor GA 180-315 VSD+,47,True,Highly reliable and efficiency oil lubricated screw compressor GA 180-315 VSD+,78,True,Oil lubricated screw compressor GA 180-315 VSD+,1,18
https://www.atlascopco.com/en-us/compressors/products/air-compressor/rotary-screw-compressor/g-series-oil-lubricated,Oil-lubricated screw compressor G (VSD),39,True,"G oil-injected screw compressor (2-250 kW) for reliable high-quality air, avoid costly downtime and production delays. Even in the harshest conditions.",151,True,Oil-lubricated screw compressor G (VSD),1,17
https://www.atlascopco.com/en-us/compressors/products/air-compressor/rotary-screw-compressor/two-stage-compressor-gr-110-200,2- stage rotary screw air compressor GR 110-200,47,True,2-stage air compressors GR provide a reliable air supply up to 20 bar for high pressure applications in the toughest working conditions like mining. Read how,157,True,2- stage rotary screw air compressor GR 110-200,1,16
https://www.atlascopco.com/en-us/compressors/products/air-compressor/rotary-screw-compressor/g2-7vsd,G 2-7 VSD – The Very Smart Decision for workshops,49,True,The new G 2-7 VSD outperforms traditional fixed-speed compressors on all these benchmarks to give you top performance for many years.,133,True,G 2-7 VSD – The Very Smart Decision for workshops,1,17
https://www.atlascopco.com/en-us/compressors/products/air-compressor/rotary-screw-compressor/ga-series,GA oil-injected screw compressors series,40,True,"GA oil-injected rotary screw compressors deliver outstanding performance, high productivity and low cost of ownership - in the harshest environments.",149,True,Oil-lubricated screw compressors GA (VSD⁺),1,18
https://www.atlascopco.com/en-us/compressors/products/air-compressor/centrifugal-compressor,Selecting a centrifugal compressor: technology explained - Atlas Copco USA,74,False,Discover our centrifugal range of air compressors designed for industries and applications that require a large supply of compressed air.,137,True,Centrifugal compressor technology explained,1,9
https://www.atlascopco.com/en-us/compressors/products/air-compressor/rotary-screw-compressor/ls-lp-cast-iron,LS and LP cast iron piston compressors,38,True,"Combine reliability and maximum productivity for demanding industrial, automotive and commercial applications. Easy to maintain, flexible, and energy-efficient. See how.",169,False,LS and LP cast iron piston compressors,1,14
